subreddit,url,title,author,linkFlairText,date
wallstreetbets,https://reddit.com/r/wallstreetbets/comments/101ahx6/most_bullish_indicator_a_commodity_can_have/,Most bullish indicator a commodity can have? Sticking it up your ass of course!,glennfromglendale,News,1672659181.0
wallstreetbets,https://reddit.com/r/wallstreetbets/comments/1017myj/bank_let_me_deposit_thousands_on_puts_when_i_only/,"Bank Let Me Deposit Thousands on Puts When I Only Had $2.33, Will They Be Ok If I Cash Out? Will They Notice?",USSTexan,Discussion,1672648516.0
Baystreetbets,https://reddit.com/r/Baystreetbets/comments/zzv1nj/who_does_everyone_follow/,Who does everyone follow?,JoeFinance44,DD,1672496245.0
Economics,https://reddit.com/r/Economics/comments/1019hza/more_than_8_million_workers_will_get_a_raise_on/,More than 8 million workers will get a raise on New Year’s Day — 23 states and D.C. will see minimum wage hikes ranging from $0.23 to $1.50 an hour,marketrent,News,1672655546.0
Economics,https://reddit.com/r/Economics/comments/1016npk/ok_mexico_save_me_after_china_this_is_where/,"‘OK, Mexico, Save Me’: After China, This Is Where Globalization May Lead",EbolaaPancakes,Editorial,1672644921.0
Economics,https://reddit.com/r/Economics/comments/1015znm/the_future_of_marijuana_legalization_could_be_a/,The future of marijuana legalization could be a monopoly,Playful-Ad6687,,1672642661.0
