subreddit,url,title,author,linkFlairText,date
wallstreetbets,https://reddit.com/r/wallstreetbets/comments/1ac9vdu/dd_on_alpha_cognition_upcoming_catalyst_alpha1062/,DD on Alpha Cognition Upcoming Catalyst (Alpha-1062),Ayy_Whats_Poppin,DD,1706358770.0
wallstreetbets,https://reddit.com/r/wallstreetbets/comments/1ac3si4/farewell_to_5_figures/,Farewell to 5 figures,SnooGuavas234,Loss,1706334482.0
wallstreetbets,https://reddit.com/r/wallstreetbets/comments/1ac2wa7/bernard_arnault_overtakes_elon_musk_as_richest/,Bernard Arnault overtakes Elon Musk as richest person in the world after Tesla earnings bloodbath,AtmosphereNo6743,News,1706331468.0
wallstreetbets,https://reddit.com/r/wallstreetbets/comments/1ac2gdc/vince_mcmahon_wwe_founder_resigns_amid_sex/,"Vince McMahon, WWE founder, resigns amid sex trafficking allegations | $NFLX",Bob_Hartley,News,1706329993.0
wallstreetbets,https://reddit.com/r/wallstreetbets/comments/1ac1rfu/youre_on_stocks_im_focused_on_passive_income_we/,You’re on stocks? I’m focused on passive income. We are not the same. 🚀🚀🚀🚀,AndyTexas,Meme,1706327757.0
Baystreetbets,https://reddit.com/r/Baystreetbets/comments/1abycdr/unveiling_quebecs_mineral_riches_abitibi_metals/,"Unveiling Quebec's Mineral Riches: Abitibi Metals Corp's CEO, Jonathan Deluce on their Gold and Copper Exploration",Califanoal,DD,1706317360.0
StockMarket,https://reddit.com/r/StockMarket/comments/1abmzu2/magnificent_7_vs_nifty_50/,Magnificent 7 vs Nifty 50,iBuY-sToCks,Discussion,1706288115.0
StockMarket,https://reddit.com/r/StockMarket/comments/1abdfmn/tesla_thesis_price_targets_50k_swing_options_trade/,"Tesla Thesis, price targets &amp; 50k swing options trade",Schuppe653898,Fundamentals/DD,1706256692.0
StockMarket,https://reddit.com/r/StockMarket/comments/1abhjda/endeavour_group_analysis_1/,Endeavour Group Analysis_1,Professional-Mud-519,Fundamentals/DD,1706273199.0
Economics,https://reddit.com/r/Economics/comments/1ac21au/us_economy_outstrips_china_adds_a_korea_worth_of/,"US Economy Outstrips China, Adds a Korea Worth of GDP - Bloomberg",AdAlarmed69,,1706328615.0
Economics,https://reddit.com/r/Economics/comments/1abtgqs/why_the_us_economy_is_doing_so_much_better_than/,Why the US economy is doing so much better than the rest of the world,bambin0,,1706304524.0
Economics,https://reddit.com/r/Economics/comments/1abs3fv/unemployment_rate_in_mexico_closed_2023_with_its/,Unemployment rate in Mexico closed 2023 with its lowest level in 18 years [note in spanish],PachuliKing,,1706301045.0
Economics,https://reddit.com/r/Economics/comments/1abq0lb/atlantas_squatter_problem_is_vexing_wall_street/,Atlanta’s Squatter Problem Is Vexing Wall Street Landlords,bloomberg,News,1706295731.0
