subreddit,url,title,author,linkFlairText,date
wallstreetbets,https://reddit.com/r/wallstreetbets/comments/18vu8gl/we_are_fucked/,We are fucked?,alain1233,Meme,1704105452.0
wallstreetbets,https://reddit.com/r/wallstreetbets/comments/18vt89t/circle_jerkle_the_fed_will_lower_interest_rates/,"CIRCLE JERKLE! The Fed will lower interest rates under 3% as a mild recession leads to a 'soggy 2024,' UBS chief economist says",GabrielNathaniel,YOLO,1704101055.0
wallstreetbets,https://reddit.com/r/wallstreetbets/comments/18vs8as/i_just_watched_the_movie_dumb_money_and_it/,I just watched the Movie Dumb Money and it brought back a lot of emotions,Kortho1,Discussion,1704096591.0
wallstreetbets,https://reddit.com/r/wallstreetbets/comments/18vnnep/great_way_to_start_the_new_year/,Great way to start the new year,Brendawg324,Meme,1704078251.0
Baystreetbets,https://reddit.com/r/Baystreetbets/comments/18vffzt/happy_new_year/,Happy New Year!!!,jmHomeOffice,DD,1704051895.0
StockMarket,https://reddit.com/r/StockMarket/comments/18v3b06/a_portion_of_my_trading_journey_during_only_2023/,A portion of my trading journey during only 2023,mehmetwehbe,Discussion,1704011203.0
StockMarket,https://reddit.com/r/StockMarket/comments/18v09uk/thanks_to_jpow_and_tom_lee_i_was_able_to_recover/,Thanks to JPow and Tom Lee.. I was able to recover the losses for the year and then made some in my retirement account,paul_atreides_dune,Discussion,1704000068.0
Economics,https://reddit.com/r/Economics/comments/18vt03k/north_korea_fertility_rate_plummets_to_estimated/,"North Korea fertility rate plummets to estimated 1.38, South Korean officials claim",madrid987,Research,1704100030.0
Economics,https://reddit.com/r/Economics/comments/18vel4z/parroting_putins_propaganda_the_business_exodus/,‘Parroting Putin’s propaganda’: The business exodus over Ukraine was no Russian bonanza,Barch3,News,1704049476.0
Economics,https://reddit.com/r/Economics/comments/18vbv6a/will_the_economy_help_or_hurt_biden_24_krugman/,Will the Economy Help or Hurt Biden ’24? Krugman and Coy Dig Into Data.,Helicase21,Editorial,1704041764.0
Economics,https://reddit.com/r/Economics/comments/18v996j/new_jersey_unemployment_rate_rises_sharply/,"New Jersey Unemployment Rate Rises Sharply, Outpacing National Average",Quercusa1ba,,1704034223.0
