subreddit,url,title,author,linkFlairText,date
wallstreetbets,https://reddit.com/r/wallstreetbets/comments/zjvqab/daily_discussion_thread_for_december_12_2022/,"Daily Discussion Thread for December 12, 2022",OPINION_IS_UNPOPULAR,Daily Discussion,1670842811.0
Economics,https://reddit.com/r/Economics/comments/zjw9vt/many_landlords_trapped_as_interest_rates_and_rent/,Many landlords 'trapped' as interest rates and rent arrears rise,Ben_aid,News,1670844324.0
Economics,https://reddit.com/r/Economics/comments/zjuaez/how_the_west_fell_out_of_love_with_economic_growth/,How the West fell out of love with economic growth,informednews,Editorial,1670838599.0
Economics,https://reddit.com/r/Economics/comments/zjredj/european_parliament_shaken_by_qatar_corruption/,European parliament shaken by Qatar corruption scandal,No_Cow1,News,1670830450.0
Economics,https://reddit.com/r/Economics/comments/zjombu/treasury_secretary_janet_yellen_on_recession/,"Treasury Secretary Janet Yellen on recession fears, inflation and the war in Ukraine",TheThinkingMonk,News,1670823226.0
