subreddit,url,title,author,linkFlairText,date
wallstreetbets,https://reddit.com/r/wallstreetbets/comments/zksyw8/daily_discussion_thread_for_december_13_2022/,"Daily Discussion Thread for December 13, 2022",OPINION_IS_UNPOPULAR,Daily Discussion,1670929210.0
Baystreetbets,https://reddit.com/r/Baystreetbets/comments/zklasi/educating_clients_like_microsoft_ibm_cisco_disney/,"Educating clients like Microsoft, IBM, Cisco, Disney, and Citi in bloackchain: The Crypto Company (OTC: $CRCW)",columneaexcretesr05,DD,1670902980.0
Baystreetbets,https://reddit.com/r/Baystreetbets/comments/zkkgrp/the_primary_care_physician_market_is_worth_over/,"The primary care physician market is worth over $260B: (OTCQB: MITI) Mitesco, Inc.",digamymagadisg88,DD,1670900642.0
Baystreetbets,https://reddit.com/r/Baystreetbets/comments/zk49fv/atlas_salt_inc_tsxv_salt_otcqb_remrf_the_great/,Atlas Salt Inc. (TSXV : SALT) (OTCQB : REMRF) The Great Canadian Salt Deposit,MightBeneficial3302,DD,1670863644.0
Economics,https://reddit.com/r/Economics/comments/zkt3ny/federal_deficit_widened_to_a_record_249_billion/,Federal Deficit Widened to a Record $249 Billion Last Month,xavier_mamba,News,1670929668.0
