subreddit,url,title,author,linkFlairText,date
wallstreetbets,https://reddit.com/r/wallstreetbets/comments/zzrp41/elon_musk_becomes_first_person_ever_to_lose_200/,Elon Musk Becomes First Person Ever To Lose $200 Billion,nyamenehene1,Loss,1672484605.0
StockMarket,https://reddit.com/r/StockMarket/comments/zzraan/high_tide_recaps_key_milestones_of_2022/,High Tide Recaps Key Milestones of 2022,Philip19967,Fundamentals/DD,1672483084.0
Economics,https://reddit.com/r/Economics/comments/zzn59a/exclusive_drugmakers_to_raise_prices_on_at_least/,Exclusive: Drugmakers to raise prices on at least 350 drugs in U.S. in January,Different-Shake8462,,1672466894.0
Economics,https://reddit.com/r/Economics/comments/zzj9ej/new_york_times_do_you_want_to_buy_a_house_in/,New York Times | Do You Want to Buy a House in Canada? Not So Fast.,NineteenSixtySix,News,1672454651.0
Economics,https://reddit.com/r/Economics/comments/zz8prs/in_search_of_a_new_economic_model_determined_by/,In search of a new economic model determined by logistic growth,soundssserious,Research,1672427475.0
