subreddit,url,title,author,linkFlairText,date
wallstreetbets,https://reddit.com/r/wallstreetbets/comments/188ybcd/what/,What.,Synfinium,Meme,1701501534.0
StockMarket,https://reddit.com/r/StockMarket/comments/188jrm6/should_i_buy_into_taketwo_interactive_ahead_of/,should I buy into TakeTwo Interactive ahead of the GTA VI trailer?!,MrLocoLobo,Opinion,1701457718.0
Economics,https://reddit.com/r/Economics/comments/188scu2/opinion_ukraine_aids_bestkept_secret_most_of_the/,Opinion | Ukraine aid’s best-kept secret: Most of the money stays in the U.S.A.,Barch3,News,1701481009.0
Economics,https://reddit.com/r/Economics/comments/188q2ud/should_we_believe_americans_when_they_say_the/,Should we believe Americans when they say the economy is bad?,mostanonymousnick,Statistics,1701474488.0
Economics,https://reddit.com/r/Economics/comments/188j1t6/federal_reserves_jay_powell_says_premature_to/,Federal Reserve’s Jay Powell says ‘premature’ to rule out further rate rises — But traders brush off central bank chair’s warning that ‘progress must continue’ in inflation fight,marketrent,News,1701455851.0
