subreddit,url,title,author,linkFlairText,date
wallstreetbets,https://reddit.com/r/wallstreetbets/comments/163hyxh/daily_discussion_thread_for_august_28_2023/,"Daily Discussion Thread for August 28, 2023",OPINION_IS_UNPOPULAR,Daily Discussion,1693217005.0
wallstreetbets,https://reddit.com/r/wallstreetbets/comments/163bppa/anyone_shorting_nvidia_hype_about_to_die/,Anyone Shorting Nvidia ? Hype about to die!!,Quirky_Ad3179,Chart,1693195592.0
wallstreetbets,https://reddit.com/r/wallstreetbets/comments/163aaji/i_am_done_daily_trading_this_is_only_one_account/,I am done daily trading. This is only one account.,Gullible-Dance-1704,Loss,1693191388.0
Baystreetbets,https://reddit.com/r/Baystreetbets/comments/162o3g2/an_important_pivotal_moment_has_been_reached_and/,An important pivotal moment has been reached. And the Uranium spotmarket is about to become much more tight (A detailed report),Napalm-1,DD,1693136230.0
StockMarket,https://reddit.com/r/StockMarket/comments/162wleh/what_company_is_louis_navallier_talking_about/,What company is Louis Navallier talking about?,cubsbullsbearsz,Discussion,1693157610.0
StockMarket,https://reddit.com/r/StockMarket/comments/162cacg/daily_investment/,Daily investment,Friendly_Affect_1316,Discussion,1693098009.0
StockMarket,https://reddit.com/r/StockMarket/comments/162b7tz/slow_month/,Slow Month 🐢,YGLD,Meme,1693095078.0
Economics,https://reddit.com/r/Economics/comments/163cdg5/chinas_10_trillion_hidden_debt_mountain_could_be/,China's $10 trillion hidden debt mountain could be the 'ticking time bomb' that Joe Biden warned of,pipercomputer,Editorial,1693197667.0
Economics,https://reddit.com/r/Economics/comments/1638qci/france_to_pay_farmers_200mn_for_destroying_wine/,France to pay farmers €200mn for destroying wine surplus,Severe_County_5041,News,1693187000.0
Economics,https://reddit.com/r/Economics/comments/1633xgl/why_is_check_fraud_suddenly_rampant/,Why is check fraud suddenly rampant?,LoansPayDayOnline,News,1693174616.0
