subreddit,url,title,author,linkFlairText,date
wallstreetbets,https://reddit.com/r/wallstreetbets/comments/15tiypl/daily_discussion_thread_for_august_17_2023/,"Daily Discussion Thread for August 17, 2023",OPINION_IS_UNPOPULAR,Daily Discussion,1692266452.0
StockMarket,https://reddit.com/r/StockMarket/comments/15tcuqf/why_are_analysts_increasing_nvidias_price_target/,"Why Are Analysts Increasing NVIDIA’s Price Target? Is It Out of Fear That Something Bad Will Happen, Leading Them to Encourage Others to Buy for their own profits?",Huge-Attention-6205,Discussion,1692246795.0
StockMarket,https://reddit.com/r/StockMarket/comments/15sxpqz/us_recession_probability_showing_highest_level/,US recession probability showing highest level since 1980's for May '24,marketsimulator,Meta,1692210183.0
StockMarket,https://reddit.com/r/StockMarket/comments/15swenu/what_do_i_do_zero_experiencewas_trying_to_learn/,What do I do? Zero experience…was trying to learn but can’t grasp the market,Tigerbalmxyz,Help Needed,1692207251.0
Economics,https://reddit.com/r/Economics/comments/15tja73/opinion_bank_of_canada_stuck_wondering_why/,Opinion: Bank of Canada stuck wondering why interest rate hikes have not been enough to tame inflation,Severe_County_5041,Editorial,1692267424.0
Economics,https://reddit.com/r/Economics/comments/15t55r1/federal_reserve_minutes_toohigh_inflation_still_a/,"Federal Reserve minutes: Too-high inflation, still a threat, could require more rate hikes",marketrent,News,1692226915.0
Economics,https://reddit.com/r/Economics/comments/15t1uf1/cities_keep_building_luxury_apartments_almost_no/,"Cities keep building luxury apartments almost no one can afford — Cutting red tape and unleashing the free market was supposed to help strapped families. So far, it hasn’t worked out that way",marketrent,News,1692219459.0
