subreddit,url,title,author,linkFlairText,date
wallstreetbets,https://reddit.com/r/wallstreetbets/comments/161rqlk/elon_musk_touts_ketamine_for_depression_following/,Elon Musk Touts Ketamine For Depression Following Report On His Use Of Drug,OneiceT,News,1693046331.0
wallstreetbets,https://reddit.com/r/wallstreetbets/comments/161p255/what_am_i_doing_wrong/,What am I doing wrong?,Ok-Professor5181,Loss,1693037294.0
wallstreetbets,https://reddit.com/r/wallstreetbets/comments/161ot8c/dollar_dumped_india_just_bought_1_million_barrels/,Dollar dumped? India just bought 1 million barrels of oil from the UAE using rupees instead of USD for the first time,BlazingJava,News,1693036479.0
Baystreetbets,https://reddit.com/r/Baystreetbets/comments/16119rp/nrxs_neuraxis_earns_14_price_target_from_gscr/,$NRXS NeurAxis Earns $14 Price Target from GSCR Analyst Based on Potential to Revolutionize Pediatric FAP and IBS Treatments,GeorgeCostanzaStocks,DD,1692974695.0
StockMarket,https://reddit.com/r/StockMarket/comments/161ctf8/nvda_has_reached_the_100th_percentile_of/,NVDA has reached the 100th percentile of valuation multiples relative to its history and broader markets,InternationalTop2405,Fundamentals/DD,1693001315.0
StockMarket,https://reddit.com/r/StockMarket/comments/1615hak/why_i_shouldnt_own_300_shares_of_blackberry/,Why I shouldn't own 300 shares of Blackberry,back2dashire,Fundamentals/DD,1692984299.0
StockMarket,https://reddit.com/r/StockMarket/comments/1614it1/remember_that_ceo_who_mass_fired_employees_on/,Remember that CEO who mass fired employees on Zoom. Well his company IPOed today.,anomerica,News,1692982139.0
StockMarket,https://reddit.com/r/StockMarket/comments/160a21w/nvidia_hard_carrying_my_account_fr/,Nvidia hard carrying my account fr,xjerielle,Opinion,1692901783.0
Economics,https://reddit.com/r/Economics/comments/161rfb2/china_has_10_years_left_at_most_100_million/,"'China Has 10 Years Left, At Most' — 100 Million Population Drop Could Lead To Economic Disaster, According To Famed Analyst",Double-Round,,1693045309.0
Economics,https://reddit.com/r/Economics/comments/1618zd1/ceos_of_top_100_lowwage_us_firms_earn_601_for/,"CEOs of top 100 ‘low-wage’ US firms earn $601 for every $1 by worker, report finds",sillychillly,Research,1692992410.0
Economics,https://reddit.com/r/Economics/comments/1616uyc/population_decline_is_not_this_nightmare/,Population decline is not this nightmare situation big business will have you believe ?,swattme88,Research,1692987477.0
