subreddit,url,title,author,linkFlairText,date
wallstreetbets,https://reddit.com/r/wallstreetbets/comments/1666vnj/daily_discussion_thread_for_august_31_2023/,"Daily Discussion Thread for August 31, 2023",OPINION_IS_UNPOPULAR,Daily Discussion,1693476119.0
wallstreetbets,https://reddit.com/r/wallstreetbets/comments/1666cb1/the_great_exodus_has_begun_nvda/,The great exodus has begun. $NVDA,Debtski,News,1693474323.0
wallstreetbets,https://reddit.com/r/wallstreetbets/comments/1663lm1/3k_to_30k_today/,- $3k to +$30k today,marsbup2,Discussion,1693464799.0
wallstreetbets,https://reddit.com/r/wallstreetbets/comments/1663lj4/am_i_a_genius_or_am_i_just_highly_regarded/,Am I a Genius or am I Just Highly Regarded?,nancypelosisson,Discussion,1693464791.0
wallstreetbets,https://reddit.com/r/wallstreetbets/comments/1662qhm/we_are_fucked/,We are fucked,TotherCanvas249,Meme,1693461882.0
Baystreetbets,https://reddit.com/r/Baystreetbets/comments/1665qus/highlights_of_august_progress_made_by_draganfly/,"Highlights of August progress made by Draganfly, an autonomous drone solutions provider, data and more.",WilliamBlack97AI,DD,1693472229.0
StockMarket,https://reddit.com/r/StockMarket/comments/165lmue/cannabis_stocks_jump_as_hhs_calls_for_easing/,Cannabis stocks jump as HHS calls for easing restrictions,Major_Bandicoot_3239,News,1693417890.0
Economics,https://reddit.com/r/Economics/comments/1662hn9/koreas_q2_fertility_rate_drops_to_record_low_of/,Korea’s Q2 fertility rate drops to record low of 0.7 amid population decline,madrid987,News,1693461070.0
Economics,https://reddit.com/r/Economics/comments/165gkai/us_economy_grew_at_slower_21_pace_in_second/,"U.S. economy grew at slower 2.1% pace in second quarter, new GDP figures show",AptitudeSky,News,1693406381.0
