subreddit,url,title,author,linkFlairText,date
wallstreetbets,https://reddit.com/r/wallstreetbets/comments/15hvu3r/daily_discussion_thread_for_august_04_2023/,"Daily Discussion Thread for August 04, 2023",OPINION_IS_UNPOPULAR,Daily Discussion,1691143263.0
Baystreetbets,https://reddit.com/r/Baystreetbets/comments/15hu3iq/indepth_and_detailed_research_of_a_nascent_and/,In-depth and detailed research of a nascent and disruptive company in the digital wellness space,WilliamBlack97AI,DD,1691137364.0
StockMarket,https://reddit.com/r/StockMarket/comments/15hkh7n/amzn_q2_2023_earnings_report/,AMZN Q2 2023 Earnings Report,heyitsflaco,Fundamentals/DD,1691107485.0
StockMarket,https://reddit.com/r/StockMarket/comments/15hcn61/yield_curve_inversion_recessions_and_sp_500/,"Yield Curve Inversion, Recessions, and S&amp;P 500 Drawdowns",marketsimulator,Meta,1691089113.0
Economics,https://reddit.com/r/Economics/comments/15hgj8h/high_profit_margins_on_gasoline_are_costing/,High profit margins on gasoline are costing drivers more,EOTR_DC,News,1691097916.0
