subreddit,url,title,author,linkFlairText,date
wallstreetbets,https://reddit.com/r/wallstreetbets/comments/z1s2ol/if_this_can_happen_then_anything_can_happen/,If this can happen. Then anything can happen. Gamble responsibly :),shroinvestor,Meme,1669119308.0
wallstreetbets,https://reddit.com/r/wallstreetbets/comments/z1rtxy/new_york_times_invites_sam_bankmanfried_treasury/,"New York Times invites Sam Bankman-Fried, Treasury Secretary Janet Yellen, BlackRock CEO Larry Fink and Mark Zuckerberg To Speak At Summit",thejollytodger,News,1669118545.0
wallstreetbets,https://reddit.com/r/wallstreetbets/comments/z1qpto/daily_discussion_thread_for_november_22_2022/,"Daily Discussion Thread for November 22, 2022",OPINION_IS_UNPOPULAR,Daily Discussion,1669114812.0
Baystreetbets,https://reddit.com/r/Baystreetbets/comments/z1e9bj/the_global_nuclear_power_renaissance_is_speeding/,"The Global Nuclear Power Renaissance is speeding up, while the global uranium supply and demand is in a growing structural deficit.",Napalm-1,DD,1669074225.0
Baystreetbets,https://reddit.com/r/Baystreetbets/comments/z1c1ir/lbnk/,LBNK,denbusstop,DD,1669068866.0
Baystreetbets,https://reddit.com/r/Baystreetbets/comments/z0zmtx/canadas_trendsetter_in_the_mushroom_market_cse/,Canada's Trendsetter in the Mushroom Market (CSE: $PSYC) Psyched Wellness,digamymagadisg88,DD,1669039084.0
StockMarket,https://reddit.com/r/StockMarket/comments/z1slp5/high_tide_becomes_top_revenuegenerating_cannabis/,High Tide Becomes Top Revenue-Generating Cannabis Company in Canada,Philip19967,Fundamentals/DD,1669120838.0
Economics,https://reddit.com/r/Economics/comments/z1ohy5/millennials_have_more_debt_and_many_will_be/,Millennials Have More Debt and Many will be Renters for Life,sozar12,Blog,1669106152.0
