subreddit,url,title,author,linkFlairText,date
wallstreetbets,https://reddit.com/r/wallstreetbets/comments/yl1rg0/boe_hikes_up_rates_75bp_highest_hike_in_30yr_and/,BOE hikes up rates 75bp (highest hike in 30yr) and this is the result. Wtf is wrong with the pounds?,SnooEagles8588,Chart,1667479124.0
StockMarket,https://reddit.com/r/StockMarket/comments/yl1boy/arway_corp_releases_platform_upgrades/,ARway Corp. Releases Platform Upgrades,Philip19967,Fundamentals/DD,1667477964.0
StockMarket,https://reddit.com/r/StockMarket/comments/ykuuqc/do_you_guys_know_what_the_heck_happened_in/,Do you guys know what the heck happened in Cineworld?,Unlucky_26,Opinion,1667458967.0
Economics,https://reddit.com/r/Economics/comments/ykx6ne/federal_reserve_chairman_jerome_powell_says/,"Federal Reserve Chairman Jerome Powell says interest rate hikes set to go further than forecast, with inflation still running at over 8%",Mean-Juggernaut1560,,1667467478.0
Economics,https://reddit.com/r/Economics/comments/ykvc6d/jay_powell_warns_us_rates_will_peak_at_higher/,Jay Powell warns US rates will peak at higher level than expected,Noah_3012,News,1667460788.0
