subreddit,url,title,author,linkFlairText,date
wallstreetbets,https://reddit.com/r/wallstreetbets/comments/yvtvqv/daily_discussion_thread_for_november_15_2022/,"Daily Discussion Thread for November 15, 2022",OPINION_IS_UNPOPULAR,Daily Discussion,1668510013.0
wallstreetbets,https://reddit.com/r/wallstreetbets/comments/yvo3pt/upstart_back_on_regshow_im_gonna_squirt/,Upstart back on regshow. I’m gonna squirt.,robertlemkin20,YOLO,1668490595.0
wallstreetbets,https://reddit.com/r/wallstreetbets/comments/yvnpgj/upst_back_on_regsho_30_of_volume_traded_failed_in/,UPST Back on RegSHO / 30% of volume traded Failed in the last period.,gherkinit,Chart,1668489344.0
Baystreetbets,https://reddit.com/r/Baystreetbets/comments/yvwbi2/enterprise_group_inc_tsx_e_reaching_new_highs/,"Enterprise Group, Inc. (TSX: E) Reaching new highs after a record 2022 so far $E.TO",PhilipCMS,DD,1668516676.0
Baystreetbets,https://reddit.com/r/Baystreetbets/comments/yvgurg/syh_webinar/,SYH webinar,denbusstop,DD,1668470152.0
StockMarket,https://reddit.com/r/StockMarket/comments/yvpxby/quisitive_reports_third_quarter_2022_financial/,Quisitive Reports Third Quarter 2022 Financial Results,Philip19967,Fundamentals/DD,1668496917.0
Economics,https://reddit.com/r/Economics/comments/yvtl7t/world_population_hits_8_billion_not_enough_young/,"World population hits 8 billion: Not enough young, skilled people in an overpopulated world",Brook030,News,1668509132.0
Economics,https://reddit.com/r/Economics/comments/yvq3fq/cryptocurrencies_nearly_threequarters_of_bitcoin/,Cryptocurrencies: nearly three-quarters of Bitcoin buyers have lost money,dirtydominion,News,1668497559.0
