subreddit,url,title,author,linkFlairText,date
wallstreetbets,https://reddit.com/r/wallstreetbets/comments/17lba3a/amd_12_month_price_objectives_reduced_by_average/,AMD 12 month price objectives reduced by average 10-15%,Rare-ish_Bird,DD,1698842691.0
wallstreetbets,https://reddit.com/r/wallstreetbets/comments/17la1r1/will_tmus_buy_lumen_technologies_to_compete_with/,Will $TMUS buy Lumen Technologies to compete with $VZ and $T?,stillness0072,DD,1698838497.0
wallstreetbets,https://reddit.com/r/wallstreetbets/comments/17l9htl/when_will_be_my_downfall/,When will be my downfall?,FatDabRigHit,Gain,1698836382.0
wallstreetbets,https://reddit.com/r/wallstreetbets/comments/17l8ny8/daily_discussion_thread_for_november_01_2023/,"Daily Discussion Thread for November 01, 2023",OPINION_IS_UNPOPULAR,Daily Discussion,1698832865.0
wallstreetbets,https://reddit.com/r/wallstreetbets/comments/17l6n4t/wework_plans_to_file_for_bankruptcy_reports_say/,"WeWork plans to file for bankruptcy, reports say",JournalistFew2794,News,1698823280.0
wallstreetbets,https://reddit.com/r/wallstreetbets/comments/17l5qqe/how_it_started_vs_how_its_going/,How it started vs. How it's going,Slut_Spoiler,Meme,1698819150.0
StockMarket,https://reddit.com/r/StockMarket/comments/17kt86a/thoughts_on_rivian_rivn/,Thoughts on Rivian (RIVN)?,MoonMyWay,Discussion,1698780607.0
Economics,https://reddit.com/r/Economics/comments/17l5kdz/gen_x_retirement_savings_average_household_has/,Gen X Retirement Savings: Average Household Has Just $40K — Here’s How Much It Should Have,Top-Organization-124,Editorial,1698818421.0
