subreddit,url,title,author,linkFlairText,date
Baystreetbets,https://reddit.com/r/Baystreetbets/comments/17wym9i/copper_breaking_out_mining_giant_teck_tck_sells/,"Copper Breaking Out, Mining Giant Teck $TCK Sells Assets To Focus On Its Copper Assets! What Copper Players Offer Torque In A Bull Market?",boogawooga8558,DD,1700171732.0
Baystreetbets,https://reddit.com/r/Baystreetbets/comments/17wqvux/plsrv_recently_listed_helium_developer_with_major/,"$PLSR.V recently listed #helium developer with major catalysts pending - fully funded, low market cap",copperbull,DD,1700151655.0
StockMarket,https://reddit.com/r/StockMarket/comments/17x3aig/everyone_buy_in_intel/,Everyone buy in Intel.,DefiantRide872,Resources,1700184092.0
StockMarket,https://reddit.com/r/StockMarket/comments/17wt2ji/the_collapse_of_the_uamps_deal_raises_the/,The Collapse of the UAMPS Deal Raises the Prospect of Bankruptcy for NuScale,CapitalManufacturer7,Fundamentals/DD,1700157265.0
Economics,https://reddit.com/r/Economics/comments/17wy1kb/tipping_culture_in_america/,Tipping Culture in America,beeemkcl,Statistics,1700170270.0
Economics,https://reddit.com/r/Economics/comments/17wu7po/mens_employment_crisis_only_41_experienced_steady/,Men's Employment Crisis: Only 41% Experienced Steady Careers,Salami_Slicer,Research Summary,1700160284.0
Economics,https://reddit.com/r/Economics/comments/17wt49g/inflation_updates_producer_price_index_shows/,Inflation updates: Producer Price Index shows post-COVID surge appears over,OtmShanks55,,1700157398.0
