subreddit,url,title,author,linkFlairText,date
wallstreetbets,https://reddit.com/r/wallstreetbets/comments/xqc5j2/gme_and_the_number_69_how_t69_could_be_the_secret/,GME and the number 69. How T+69 could be the secret to tendietown.,hardyrekshin,DD,1664370107.0
Baystreetbets,https://reddit.com/r/Baystreetbets/comments/xpm9la/nasdaq_ecor_electrocore_inc_dd/,"(NASDAQ: $ECOR) electroCore, Inc. {DD}",digamymagadisg88,DD,1664297998.0
StockMarket,https://reddit.com/r/StockMarket/comments/xq7a6p/today_he_speaks/,Today he speaks...,Tintin230,Meme,1664354775.0
Economics,https://reddit.com/r/Economics/comments/xq7uiu/moodys_warns_uk_unfunded_tax_cuts_are_credit/,Moody's warns UK unfunded tax cuts are 'credit negative',marketrent,News,1664356833.0
railroading,https://reddit.com/r/railroading/comments/xpx6c7/smart_ferguson_talks_about_the_ta_of_course/,SMART Ferguson talks about the TA. Of course comments are turned off cause why would they want to hear from us...,SNBoomer,Railroad News,1664323927.0
railroading,https://reddit.com/r/railroading/comments/xpta3e/looks_like_well_be_finishing_2022_without_seeing/,Looks like we'll be finishing 2022 without seeing a single penny increase to our wages...,dad_savage,Railroad News,1664314149.0
railroading,https://reddit.com/r/railroading/comments/xpn681/the_carriers_cant_fill_jobs_now_and_are_forcing/,"The carriers can't fill jobs now, and are forcing everyone to mandatory overtime... What do they think they will do with self sustained pools that have days off? What imaginary employees do they think are going to fill those vacancies? On top of giving the carriers 100% control of the boards.",Current_Steak8556,Discussion,1664300064.0
railroading,https://reddit.com/r/railroading/comments/xpmzio/they_must_think_we_are_stupid_tentative_2/,They must think we are stupid. Tentative #2,hotfur,,1664299639.0
railroading,https://reddit.com/r/railroading/comments/xpmo09/im_a_new_dispatcher_and_still_have_a_ton_to_learn/,I’m a new dispatcher and still have a ton to learn. Wondering if you guys could give me some tips,johhnytexas,,1664298890.0
railroading,https://reddit.com/r/railroading/comments/xpjlfg/4am_service_call_lighting_controller_offline_all/,"4am Service Call - Lighting controller offline - all 61,500 watts or 6.97 million lumens back online! (Video link in comments)",mikeblas,,1664291877.0
railroading,https://reddit.com/r/railroading/comments/xpetym/how_the_rail_unions_plan_to_ram_through_their/,How the rail unions plan to ram through their sellout contracts,PLA_DRTY,,1664280086.0
railroading,https://reddit.com/r/railroading/comments/xp9brl/international_locomotive_engineer_jobs/,International locomotive engineer jobs,Delicious-Phase608,,1664262062.0
