subreddit,url,title,author,linkFlairText,date
wallstreetbets,https://reddit.com/r/wallstreetbets/comments/16ud2ex/its_official/,It’s official,Head_Plantain1882,News,1695899387.0
wallstreetbets,https://reddit.com/r/wallstreetbets/comments/16uctjm/market_crash_is_now_confirmed_always_inverse_wsb/,"Market crash is now confirmed, always inverse WSB",ErectoPeentrounus,Meme,1695898626.0
wallstreetbets,https://reddit.com/r/wallstreetbets/comments/16ubth6/daily_discussion_thread_for_september_28_2023/,"Daily Discussion Thread for September 28, 2023",OPINION_IS_UNPOPULAR,Daily Discussion,1695895283.0
wallstreetbets,https://reddit.com/r/wallstreetbets/comments/16ubsth/literally_stfu_about_the_socalled_alleged/,Literally STFU About the So-Called Alleged Upcoming Market Crash,helloregards,Discussion,1695895230.0
Baystreetbets,https://reddit.com/r/Baystreetbets/comments/16u41lr/grts_after_hours_news/,$GRTS After Hours News 🗞️,YGLD,DD,1695868364.0
Baystreetbets,https://reddit.com/r/Baystreetbets/comments/16u3bed/nili_7m_tons_lce_estimate/,NILI - 7M tons LCE estimate,Manudonuts,DD,1695866439.0
Baystreetbets,https://reddit.com/r/Baystreetbets/comments/16tp2hz/osisko_metals_om_is_trading_at_50_discount_to/,Osisko Metals $OM is trading at 50% discount to Glencore's conversion price of the Gaspe Copper Mine,Soggy-Job4187,DD,1695831955.0
StockMarket,https://reddit.com/r/StockMarket/comments/16tkgl6/evergrande_stock_crashes_again_as_fears_of/,Evergrande stock crashes again as fears of collapse grow | CNN Business,sleepy-panda521,News,1695820886.0
StockMarket,https://reddit.com/r/StockMarket/comments/16teeci/a_government_shutdown_threatens_the_stock_market/,A Government Shutdown Threatens the Stock Market. Moves to Make Now.,Possible_Park1082,News,1695801046.0
Economics,https://reddit.com/r/Economics/comments/16tmnzj/another_government_shutdown_would_have_dire/,"Another government shutdown would have dire consequences, Moody's warns",GetRichQuickSchemer_,News,1695826302.0
Economics,https://reddit.com/r/Economics/comments/16tlu14/breaking_us_senate_committee_passes_marijuana/,BREAKING: US Senate Committee Passes Marijuana Banking Bill,JamesAsher12,News,1695824236.0
Economics,https://reddit.com/r/Economics/comments/16tkuqt/greece_battered_a_decade_ago_is_suddenly_booming/,"Greece, Battered a Decade Ago, Is Suddenly Booming",depressed-n-awkward,,1695821812.0
Economics,https://reddit.com/r/Economics/comments/16tg5m5/skorea_extends_natural_population_decline_on_low/,"S.Korea extends natural population decline on low births, aging demographic",madrid987,News,1695807809.0
Economics,https://reddit.com/r/Economics/comments/16tfgbk/oil_prices_hold_steady_at_90_a_barrel_as_wall/,Oil prices hold steady at $90 a barrel as Wall Street weighs GDP impact,Possible_Park1082,News,1695805130.0
