subreddit,url,title,author,linkFlairText,date
wallstreetbets,https://reddit.com/r/wallstreetbets/comments/16gp80d/the_stock_market_in_a_nutshell_bears_vs_bulls/,The stock market in a nutshell Bears vs Bulls,Silverpatriot7,Meme,1694519237.0
wallstreetbets,https://reddit.com/r/wallstreetbets/comments/16gn8jj/daily_discussion_thread_for_september_12_2023/,"Daily Discussion Thread for September 12, 2023",OPINION_IS_UNPOPULAR,Daily Discussion,1694512896.0
wallstreetbets,https://reddit.com/r/wallstreetbets/comments/16gmwf3/why_starbucks_is_losing_to_luckin_coffee_in_china/,Why Starbucks is losing to Luckin Coffee in China and why this likely won’t change.,Alternative-Paint-46,DD,1694511660.0
wallstreetbets,https://reddit.com/r/wallstreetbets/comments/16gmap2/offshore_windpower_discounted/,Offshore Windpower discounted,gewur33,DD,1694509477.0
wallstreetbets,https://reddit.com/r/wallstreetbets/comments/16glm8y/marijuana_stocks_are_sellonly_on_cashapp/,Marijuana stocks are Sell-only on Cashapp,dmfuller,News,1694506975.0
Baystreetbets,https://reddit.com/r/Baystreetbets/comments/16g5a2k/tco_has_better_gold_grades_than_companies_with/,"$TCO has better gold grades than companies with some multiple higher market caps $TWR $RSMX $MLM $DYG $AE this only compares 1 of 3 projects. Grades of 7&amp;8 g/t Au (incl 13 g/t Au). Grab sample of 28 g/t Au. Copper of 15% CU (production in 1910). Financing done and start new drilling, pending results",FindBetterStocks,DD,1694461876.0
StockMarket,https://reddit.com/r/StockMarket/comments/16g859s/what_happened_to_etsy_stock_down_15_in_a_month/,"What happened to ETSY stock, down 15% in a month",abrown6251,Discussion,1694468073.0
Economics,https://reddit.com/r/Economics/comments/16gk9em/more_than_half_of_s_korean_regions_facing/,More than half of S. Korean regions facing population crisis,madrid987,News,1694502097.0
Economics,https://reddit.com/r/Economics/comments/16g941k/john_hewson_markets_have_failed_on_housing/,John Hewson: Markets have failed on housing,marketrent,Editorial,1694470185.0
Economics,https://reddit.com/r/Economics/comments/16g86gl/the_libertarian_telling_of_economic_history_is/,The Libertarian Telling of Economic History is Intellectually Unserious,RememberRossetti,Blog,1694468145.0
