subreddit,url,title,author,linkFlairText,date
wallstreetbets,https://reddit.com/r/wallstreetbets/comments/16k3brl/egypts_inflation_rose_to_374_in_aug_a_record_high/,"Egypt’s inflation rose to 37.4% in Aug, a record high. Food costs were up 71%. 2%Target?",betsharks0,Chart,1694857321.0
wallstreetbets,https://reddit.com/r/wallstreetbets/comments/16jtwjc/this_week_the_market_really_gave_it_to_us/,This week the market really gave it to us,Silverpatriot7,Meme,1694824972.0
wallstreetbets,https://reddit.com/r/wallstreetbets/comments/16jtvp4/peak_economy_confirmed_bears_rejoice/,Peak economy confirmed. Bears rejoice.,gonzo8927,Meme,1694824905.0
wallstreetbets,https://reddit.com/r/wallstreetbets/comments/16jtqnb/uber_taking_over/,Uber taking over,Dreamsssog,Meme,1694824503.0
wallstreetbets,https://reddit.com/r/wallstreetbets/comments/16jsd88/going_to_stick_with_buying_shares_in_blue_chips/,going to stick with buying shares in blue chips and investment funds.,NotAsYoungAsiUseToBe,Loss,1694820583.0
wallstreetbets,https://reddit.com/r/wallstreetbets/comments/16jr8i3/apparently_uaw_strike_is_bullish_for_stocks_f_gm/,"Apparently, UAW Strike Is Bullish For Stocks - F, GM and STLA are up today",Ok_Significance_4008,Chart,1694817699.0
wallstreetbets,https://reddit.com/r/wallstreetbets/comments/16jq8xg/my_alltime_loss_porn/,My All-Time Loss Porn,TechGuy135,Loss,1694815218.0
wallstreetbets,https://reddit.com/r/wallstreetbets/comments/16jpxao/why_this_collapse_is_the_us_in_lockdown/,Why this collapse? Is the US in lockdown?,Shinobi0wl,Chart,1694814423.0
Economics,https://reddit.com/r/Economics/comments/16jwwwx/what_causes_inflation_we_spoke_to_former_atlanta/,What Causes Inflation? We Spoke to Former Atlanta Fed President Dennis Lockhart,pepperymotion,Interview,1694834216.0
Economics,https://reddit.com/r/Economics/comments/16jwgel/donald_trump_wants_to_give_his_favorite/,Donald Trump Wants to Give His Favorite Corporations Another Giant Tax Cut in a Second Term: Report,Plenty-Agent-7112,,1694832750.0
