subreddit,url,title,author,linkFlairText,date
wallstreetbets,https://reddit.com/r/wallstreetbets/comments/16v7g6m/daily_discussion_thread_for_september_29_2023/,"Daily Discussion Thread for September 29, 2023",OPINION_IS_UNPOPULAR,Daily Discussion,1695981704.0
wallstreetbets,https://reddit.com/r/wallstreetbets/comments/16uzfk5/briefing_microsoft_reportedly_tried_to_sell_bing/,Briefing: Microsoft Reportedly Tried to Sell Bing to Apple in 2020,No_Zookeepergame_27,News,1695954296.0
wallstreetbets,https://reddit.com/r/wallstreetbets/comments/16uyxbs/the_end_of_an_era_the_coming_long_run_slowdown_in/,THE END OF AN ERA: THE COMING LONG RUN SLOWDOWN IN CORPORATE PROFIT GROWTH AND STOCK RETURNS,Cactijuice210,DD,1695952920.0
Baystreetbets,https://reddit.com/r/Baystreetbets/comments/16uoeit/cbdw_news_out_heading_into_power_hour_1606/,"$CBDW news out heading into power hour: 1606 announces launch of ChatCBD, a revolutionary AI chatbot to enhance customer experiences",GeorgeCostanzaStocks,DD,1695927707.0
Baystreetbets,https://reddit.com/r/Baystreetbets/comments/16ujqev/aitxs_subsidiary_robotic_assistance_devices/,"$AITX’s Subsidiary, Robotic Assistance Devices, Announces Planning for 1000 RIO Version 4 Production Run",GeorgeCostanzaStocks,DD,1695916559.0
Baystreetbets,https://reddit.com/r/Baystreetbets/comments/16ugd5p/gstc_globestar_therapeutics_enters_into/,"$GSTC Globestar Therapeutics Enters into Definitive Agreement with SMI Healthcare to Manage Clinical Trial, Regulatory Filings, Manufacturing and Sales in MEA Region for Multiple Sclerosis Treatment",GeorgeCostanzaStocks,DD,1695908399.0
StockMarket,https://reddit.com/r/StockMarket/comments/16uozhs/eps_cagr_last_5_years_vs_eps_cagr_next_5y/,Eps cagr last 5 years vs Eps cagr next 5y,Roca25_,Fundamentals/DD,1695929069.0
StockMarket,https://reddit.com/r/StockMarket/comments/16ui0vo/us_stocks_are_wobbling_as_investors_worry_about_a/,U.S. stocks are wobbling as investors worry about a looming government shutdown,josh252,News,1695912483.0
Economics,https://reddit.com/r/Economics/comments/16v9wg2/homes_unaffordable_in_99_of_nation_for_average/,"Homes ""unaffordable"" in 99% of nation for average American",RunKind4141,Statistics,1695989392.0
Economics,https://reddit.com/r/Economics/comments/16v3xh8/new_california_law_raises_minimum_wage_for_fast/,"New California law raises minimum wage for fast food workers to $20 per hour, among nation’s highest",treyday22,News,1695968511.0
Economics,https://reddit.com/r/Economics/comments/16uuein/breaking_down_every_economic_claim_from_the/,"Breaking Down Every Economic Claim From The Second Republican Debate (Yes, Really.)",RememberRossetti,Blog,1695941415.0
Superstonk,https://reddit.com/r/Superstonk/comments/16vandw/this_community_needs_to_get_better_about_facts/,This community needs to get better about facts. I’ve been here since the beginning and it’s ridiculous that people are claiming the email is fake because they “feel” some way. I just went to the employee sub and saw 500 comments talking about it. Facts need to be checked and we can do better.,anonfthehfs,📚 Due Diligence,1695991395.0
Superstonk,https://reddit.com/r/Superstonk/comments/16vadrb/dont_let_congress_defund_market_structure_reform/,Don’t Let Congress Defund Market Structure Reform! Calling all “So-Called” Investors!,dlauer,📚 Due Diligence,1695990675.0
