subreddit,url,title,author,linkFlairText,date
Baystreetbets,https://reddit.com/r/Baystreetbets/comments/16p8u1k/smme_huge_news_this_week/,$SMME huge news this week:,GeorgeCostanzaStocks,DD,1695385206.0
Baystreetbets,https://reddit.com/r/Baystreetbets/comments/16on2di/ranked_worlds_largest_clay_and_hard_rock_lithium/,RANKED: World’s largest clay and hard rock lithium projects.,boogawooga8558,DD,1695320330.0
StockMarket,https://reddit.com/r/StockMarket/comments/16p3hke/how_it_started_and_this_is_how_its_going/,How it started and this is how it's going 🤣,OES33,Discussion,1695366158.0
StockMarket,https://reddit.com/r/StockMarket/comments/16okep7/td_ameritrade_moving_to_schwab/,TD Ameritrade moving to Schwab,TheBigFish2004,Discussion,1695313857.0
StockMarket,https://reddit.com/r/StockMarket/comments/16oi3nh/yield_curve_and_recessions/,Yield curve and recessions,megadave5000,Discussion,1695308310.0
StockMarket,https://reddit.com/r/StockMarket/comments/16oh2ps/spy_technical_picture/,SPY technical picture,megadave5000,Technical Analysis,1695305780.0
Economics,https://reddit.com/r/Economics/comments/16p7jsd/student_loan_forgiveness_proceeds_and_payments/,"Student Loan Forgiveness Proceeds And Payments ‘Cut In Half,’ But System Buckles",LoansPayDayOnline,News,1695381271.0
Economics,https://reddit.com/r/Economics/comments/16os9ly/the_uk_might_solve_its_housing_shortage_by_2100/,The UK Might Solve Its Housing Shortage by 2100,MaleficentParfait863,,1695332457.0
Economics,https://reddit.com/r/Economics/comments/16oojg3/strong_labor_data_increases_chance_of_fed_rate/,Strong Labor Data Increases Chance of Fed Rate Hike,bozidgha,News,1695323758.0
Economics,https://reddit.com/r/Economics/comments/16onbcv/big_business_accused_of_using_inflation_to/,"Big business accused of using inflation to disguise profit hikes during cost-of-living crisis, as price gouging inquiry begins",marketrent,News,1695320928.0
