subreddit,url,title,author,linkFlairText,date
wallstreetbets,https://reddit.com/r/wallstreetbets/comments/1675xa7/most_anticipated_earnings_releases_for_the_week/,"Most Anticipated Earnings Releases for the week beginning September 4th, 2023",OPINION_IS_UNPOPULAR,Earnings Thread,1693571713.0
wallstreetbets,https://reddit.com/r/wallstreetbets/comments/1672xpu/daily_discussion_thread_for_september_01_2023/,"Daily Discussion Thread for September 01, 2023",OPINION_IS_UNPOPULAR,Daily Discussion,1693562574.0
StockMarket,https://reddit.com/r/StockMarket/comments/166pcb1/just_got_fired/,Just got fired...,ActualPerformer2752,Discussion,1693521248.0
StockMarket,https://reddit.com/r/StockMarket/comments/166cjvp/what_does_this_mean/,What does this mean?,Traditional-Spell733,Discussion,1693491797.0
Economics,https://reddit.com/r/Economics/comments/166p299/the_feds_preferred_inflation_measure_stayed_high/,The Fed’s preferred inflation measure stayed high in July — and consumers are continuing to spend,marketrent,News,1693520580.0
