subreddit,url,title,author,linkFlairText,date
wallstreetbets,https://reddit.com/r/wallstreetbets/comments/13bn9ze/nvos/,NVOS,shortsqueezerr,DD,1683548028.0
wallstreetbets,https://reddit.com/r/wallstreetbets/comments/13bmncb/volume_tickers_in_play/,Volume tickers in play,Badboyardie,DD,1683546447.0
wallstreetbets,https://reddit.com/r/wallstreetbets/comments/13bmhgq/fed_reveals_722_banks_reported_unrealized_losses/,Fed Reveals 722 Banks Reported Unrealized Losses Over 50% of Capital as Concerns Over US Banking Crisis Grow,predictany007,News,1683546012.0
wallstreetbets,https://reddit.com/r/wallstreetbets/comments/13bmbo5/regional_banks_rebound_for_a_second_day_as/,"Regional banks rebound for a second day as PacWest cuts dividend, says business ‘fundamentally sound’",predictany007,News,1683545563.0
wallstreetbets,https://reddit.com/r/wallstreetbets/comments/13bkoue/us_economic_data_has_been_surprising_to_the/,U.S. economic data has been surprising to the upside at the fastest pace in more than a year: Bloomberg US Economic Surprise index,betsharks0,Chart,1683540981.0
wallstreetbets,https://reddit.com/r/wallstreetbets/comments/13bkdcr/daily_discussion_thread_for_may_08_2023/,"Daily Discussion Thread for May 08, 2023",OPINION_IS_UNPOPULAR,Daily Discussion,1683540079.0
StockMarket,https://reddit.com/r/StockMarket/comments/13azi4o/shortsale_ban_incoming/,SHORT-SALE BAN INCOMING 🚨🔔,RoyalMecca,News,1683486199.0
Economics,https://reddit.com/r/Economics/comments/13bl4px/biden_mccarthy_aim_to_break_us_debtceiling/,"Biden, McCarthy aim to break US debt-ceiling standoff as default crisis looms",rudy_batts,News,1683542233.0
