subreddit,url,title,author,linkFlairText,date
wallstreetbets,https://reddit.com/r/wallstreetbets/comments/136i98g/volume_tickers_in_play/,Volume tickers in play,Badboyardie,DD,1683114553.0
StockMarket,https://reddit.com/r/StockMarket/comments/136h0mz/lillys_donanemab_significantly_slowed_cognitive/,Lilly's Donanemab Significantly Slowed Cognitive and Functional Decline in Phase 3 Study of Early Alzheimer's Disease | Eli Lilly and Company,GhostSierra117,Fundamentals/DD,1683110926.0
StockMarket,https://reddit.com/r/StockMarket/comments/136324j/thoughts_on_the_treasury_yield_curve_in_this/,Thoughts on the Treasury Yield Curve in this Economy?,sam_updated_finance,Discussion,1683068004.0
StockMarket,https://reddit.com/r/StockMarket/comments/1361cgt/lawmakers_are_urging_the_federal_reserve_to_halt/,"Lawmakers are urging the Federal Reserve to halt interest rate hikes as inflation is nowhere near its 2% target as the United States is having a banking crisis, and the country is warning it could stop paying its bills by June.",thetimeisgold,News,1683063929.0
Economics,https://reddit.com/r/Economics/comments/136gb3b/14_million_jobs_worldwide_will_vanish_in_the_next/,"14 million jobs worldwide will vanish in the next 5 years, new economic report finds | CNN Business",cool_core_down,News,1683108646.0
