subreddit,url,title,author,linkFlairText,date
wallstreetbets,https://reddit.com/r/wallstreetbets/comments/13cnosd/volume_tickers_in_play/,Volume tickers in play,Badboyardie,DD,1683633744.0
wallstreetbets,https://reddit.com/r/wallstreetbets/comments/13cndqs/feel_bad_about_missing_a_play_be_inspired_by_the/,"Feel bad about missing a play? Be inspired by the highly regarded Nolan Bushnell, who declined an offer to buy a third of $AAPL for $50k",landocharisma,Meme,1683632928.0
wallstreetbets,https://reddit.com/r/wallstreetbets/comments/13cn3hx/rivn_is_undervalued_and_oversold_im_leveraged_to/,RIVN is undervalued and oversold… I’m leveraged to the tits 🌰🌰,ini0n,DD,1683632161.0
wallstreetbets,https://reddit.com/r/wallstreetbets/comments/13cl6jm/daily_discussion_thread_for_may_09_2023/,"Daily Discussion Thread for May 09, 2023",OPINION_IS_UNPOPULAR,Daily Discussion,1683626449.0
wallstreetbets,https://reddit.com/r/wallstreetbets/comments/13ci0l5/indicted_ftx_founder_sam_bankmanfried_urges_court/,Indicted FTX founder Sam Bankman-Fried urges court to toss charges,spiralstix,News,1683615117.0
Baystreetbets,https://reddit.com/r/Baystreetbets/comments/13cp7b2/fobi_announces_record_third_quarter_2023_earnings/,Fobi Announces Record Third Quarter 2023 Earnings with 298% Increase YoY,Philip19967,DD,1683637355.0
Baystreetbets,https://reddit.com/r/Baystreetbets/comments/13coyti/nextech3dai_signs_enterprise_renewal_and/,Nextech3D.ai Signs Enterprise Renewal and Expansion Contract With Major Ecommerce Brand For 3000 3D Models,Philip19967,DD,1683636828.0
StockMarket,https://reddit.com/r/StockMarket/comments/13c6h05/paypal_reported_wonderful_earnings/,Paypal reported wonderful earnings,Guysmarket,Fundamentals/DD,1683583543.0
StockMarket,https://reddit.com/r/StockMarket/comments/13c52yp/pltr_earnings_were_not_bad/,Pltr Earnings were not bad!,Guysmarket,Fundamentals/DD,1683580529.0
Economics,https://reddit.com/r/Economics/comments/13cj3b4/yellen_is_calling_ceos_personally_to_warn_on_us/,"Yellen is calling CEOs personally to warn on US debt ceiling, sources say",xavier_mamba,News,1683618914.0
Economics,https://reddit.com/r/Economics/comments/13ci0d0/goldman_sachs_joins_barclays_in_betting_against/,Goldman Sachs joins Barclays in betting against Fed rate cuts this year.,Oli_01,News,1683615098.0
Superstonk,https://reddit.com/r/Superstonk/comments/13cpeox/authors_of_cellar_boxing_mechanics/,Authors Of Cellar Boxing Mechanics,jackofspades123,📚 Due Diligence,1683637811.0
