subreddit,url,title,author,linkFlairText,date
wallstreetbets,https://reddit.com/r/wallstreetbets/comments/17cagkx/blackberry_debenture_document/,Blackberry Debenture Document,newwobblywheeler,DD,1697805966.0
wallstreetbets,https://reddit.com/r/wallstreetbets/comments/17c7m33/daily_discussion_thread_for_october_20_2023/,"Daily Discussion Thread for October 20, 2023",OPINION_IS_UNPOPULAR,Daily Discussion,1697796086.0
wallstreetbets,https://reddit.com/r/wallstreetbets/comments/17c69nm/inflation_is_here_to_stay/,Inflation is here to stay,No-Math-5079,Meme,1697790471.0
wallstreetbets,https://reddit.com/r/wallstreetbets/comments/17c5a5f/federal_reserve_bank_says_states_with_legal/,Federal Reserve Bank Says States With Legal Marijuana See 'Broadly Distributed' Economic Boost.,Infinite-Carrot1664,News,1697786230.0
Baystreetbets,https://reddit.com/r/Baystreetbets/comments/17bne22/the_latest_developments_of_tenet_fintech_a_the/,"The latest developments of Tenet Fintech, a the parent company of a group of innovative financial technology (Fintech) and artificial intelligence (AI) companies",WilliamBlack97AI,DD,1697733406.0
StockMarket,https://reddit.com/r/StockMarket/comments/17bsib2/well_that_sucks/,Well that sucks,The_Sparky01,Discussion,1697746657.0
StockMarket,https://reddit.com/r/StockMarket/comments/17bsi4k/taking_a_look_at_tsla_financials/,Taking a look at tsla financials,Guysmarket,Fundamentals/DD,1697746642.0
Economics,https://reddit.com/r/Economics/comments/17c2z9j/student_loan_payments_will_have_minimal_impact_on/,"Student Loan Payments Will Have Minimal Impact on U.S. Economy, Fed Research Shows",Top-Organization-124,News,1697776990.0
Economics,https://reddit.com/r/Economics/comments/17buos4/jobless_claims_fall_to_9month_low_of_198000_not/,"Jobless claims fall to 9-month low of 198,000. Not many layoffs in U.S. economy.",Dublers,News,1697752160.0
Economics,https://reddit.com/r/Economics/comments/17brswo/how_is_the_us_economy_managing_to_power_ahead_of/,How is the US economy managing to power ahead of Europe?,MaleficentParfait863,,1697744871.0
Superstonk,https://reddit.com/r/Superstonk/comments/17c9owv/blurring_massive_naked_short_positions_need_to_be/,"Blurring: ""Massive naked short positions need to be looked upon as huge assets."" (2004) Where we are and what lies ahead. (1/3)",beyond-mythos,📚 Due Diligence,1697803500.0
Superstonk,https://reddit.com/r/Superstonk/comments/17c9l53/blurring_massive_naked_short_positions_need_to_be/,"Blurring: ""Massive naked short positions need to be looked upon as huge assets."" (2004) Where we are and what lies ahead. (2/3)",beyond-mythos,📚 Due Diligence,1697803190.0
Superstonk,https://reddit.com/r/Superstonk/comments/17c9kyh/blurring_massive_naked_short_positions_need_to_be/,"Blurring: ""Massive naked short positions need to be looked upon as huge assets."" (2004) Where we are and what lies ahead. (3/3)",beyond-mythos,📚 Due Diligence,1697803171.0
Superstonk,https://reddit.com/r/Superstonk/comments/17c6i5x/gme_is_in_a_gamma_squeeze_thats_not_a_good_thing/,"GME is in a gamma squeeze. that‘s not a good thing!!! apes vould do something about that, but u wont like to hear it😬",Medium_Job_4114,📚 Due Diligence,1697791492.0
