subreddit,url,title,author,linkFlairText,date
wallstreetbets,https://reddit.com/r/wallstreetbets/comments/17f95se/daily_discussion_thread_for_october_24_2023/,"Daily Discussion Thread for October 24, 2023",OPINION_IS_UNPOPULAR,Daily Discussion,1698141651.0
wallstreetbets,https://reddit.com/r/wallstreetbets/comments/17f4k4h/apple_insider_giving_regards_alpha_for_0dte/,Apple insider giving regards alpha for 0DTE,TarkovRedditor,DD,1698122165.0
wallstreetbets,https://reddit.com/r/wallstreetbets/comments/17f46p6/jim_cramer_expects_lower_prices_11_october_2023/,Jim Cramer Expects Lower Prices - 11 October 2023,polloponzi,Meme,1698120864.0
wallstreetbets,https://reddit.com/r/wallstreetbets/comments/17f3ndy/i_hope_russia_has_some_good_cardiac_cath_labs/,I hope Russia has some good cardiac cath labs,NoMoreLandBro,Meme,1698119038.0
wallstreetbets,https://reddit.com/r/wallstreetbets/comments/17f21vf/dollaritas_endless_pasta_bowls/,Dollaritas … Endless pasta bowls ..,xR3ALR3CKL3SSx,Discussion,1698114110.0
StockMarket,https://reddit.com/r/StockMarket/comments/17f68ic/which_stock_should_i_hold_and_which_should_i_sell/,Which stock should i hold and which should i sell?,Willing_Support3978,Fundamentals/DD,1698128689.0
StockMarket,https://reddit.com/r/StockMarket/comments/17etzlm/russell_is_oversold_to_dust/,Russell is Oversold to Dust,vtsandtrooper,Discussion,1698092329.0
StockMarket,https://reddit.com/r/StockMarket/comments/17e9p4b/charging_foward_the_green_frontier/,Charging Foward: The Green Frontier,Infinite-Carrot1664,Meme,1698027170.0
Economics,https://reddit.com/r/Economics/comments/17f3kt5/there_are_44_so_called_advanced_economies/,"There are 44 so called “advanced economies” according to IMF…Why UAE (which has such a high GDP per capita and is much more populated than countries like San Marino, Andorra, Macao or Malta) is not included while these micro states are included?",sydneylulu,Statistics,1698118810.0
Economics,https://reddit.com/r/Economics/comments/17eylh9/an_exhaustive_review_of_thomas_sowells_new_book/,An Exhaustive Review of Thomas Sowell’s New Book,RememberRossetti,Blog,1698104146.0
Economics,https://reddit.com/r/Economics/comments/17evgvs/survey_reveals_almost_half_of_russians_dont_earn/,Survey reveals almost half of Russians don’t earn enough to afford basic necessities,Barch3,Statistics,1698095994.0
