subreddit,url,title,author,linkFlairText,date
wallstreetbets,https://reddit.com/r/wallstreetbets/comments/14jfp6z/volume_tickers_in_play/,Volume tickers in play,Badboyardie,DD,1687781666.0
wallstreetbets,https://reddit.com/r/wallstreetbets/comments/14jd373/daily_discussion_thread_for_june_26_2023/,"Daily Discussion Thread for June 26, 2023",OPINION_IS_UNPOPULAR,Daily Discussion,1687773703.0
wallstreetbets,https://reddit.com/r/wallstreetbets/comments/14j0zfq/visualmod_decided_to_post_twice_in_one_post/,VisualMod decided to post twice in one post,KickInTheNutsacks,Meme,1687736159.0
wallstreetbets,https://reddit.com/r/wallstreetbets/comments/14j0dvb/elons_mommy_wont_let_him_fight/,Elon’s mommy won’t let him fight,Kengriffinspimp,Meme,1687734602.0
wallstreetbets,https://reddit.com/r/wallstreetbets/comments/14iw6qc/markets_does_whatever_it_wants_isnt_it_all_just/,“Markets does whatever it wants” isn’t it all just robots and algorithms anyway?,Dizzyeer,Discussion,1687724477.0
wallstreetbets,https://reddit.com/r/wallstreetbets/comments/14ivnrn/what_are_your_moves_tomorrow_june_26_2023/,"What Are Your Moves Tomorrow, June 26, 2023",OPINION_IS_UNPOPULAR,Daily Discussion,1687723244.0
StockMarket,https://reddit.com/r/StockMarket/comments/14j7a28/this_mf_does_not_miss/,This mf does not miss 😂,Firm-Illustrator-416,Meme,1687754348.0
StockMarket,https://reddit.com/r/StockMarket/comments/14j244d/i_will_continue_learning_thanks_to_my_uncle_even/,"I will continue learning thanks to my Uncle, even after death.",TopRecognition5150,Discussion,1687739191.0
Economics,https://reddit.com/r/Economics/comments/14jbgop/arnold_schwarzenegger_environmentalists_are/,Arnold Schwarzenegger: Environmentalists are behind the times. And need to catch up fast.,LordVader568,Interview,1687768272.0
Economics,https://reddit.com/r/Economics/comments/14ixfs5/the_worlds_empty_office_buildings_have_become_a/,The World’s Empty Office Buildings Have Become a Debt Time Bomb,UppedVotes,News,1687727444.0
