subreddit,url,title,author,linkFlairText,date
wallstreetbets,https://reddit.com/r/wallstreetbets/comments/141co1h/daily_discussion_thread_for_june_05_2023/,"Daily Discussion Thread for June 05, 2023",OPINION_IS_UNPOPULAR,Daily Discussion,1685967372.0
wallstreetbets,https://reddit.com/r/wallstreetbets/comments/141ca8b/volume_tickers_in_play/,Volume tickers in play,Badboyardie,DD,1685966509.0
wallstreetbets,https://reddit.com/r/wallstreetbets/comments/1419ant/us_banks_prepare_for_losses_in_rush_for/,US banks prepare for losses in rush for commercial property exit,FancisJU,News,1685959006.0
wallstreetbets,https://reddit.com/r/wallstreetbets/comments/1416t5j/what_are_your_moves_tomorrow_june_06_2023/,"What Are Your Moves Tomorrow, June 06, 2023",OPINION_IS_UNPOPULAR,Daily Discussion,1685952078.0
wallstreetbets,https://reddit.com/r/wallstreetbets/comments/1416goo/to_moon_and_beyond_rwallstreetbets_posted_a_net/,To moon and beyond 💰🚀📈 - r/wallstreetbets posted a net gain of $5M in May 2023,greenskew,Discussion,1685951154.0
StockMarket,https://reddit.com/r/StockMarket/comments/140wudk/diving_into_the_container_store_tcs/,Diving into The Container Store - $TCS,From100kto1mm,Fundamentals/DD,1685926602.0
StockMarket,https://reddit.com/r/StockMarket/comments/140spp1/nvda_looks_to_have_a_classic_blow_off_top/,NVDA looks to have a classic blow off top.,Euro347,Technical Analysis,1685917604.0
StockMarket,https://reddit.com/r/StockMarket/comments/140pizo/are_the_banks_stabilizing_because_of_deposit/,Are the banks stabilizing because of deposit inflows or is it fluff?,Badboyardie,Discussion,1685911037.0
Economics,https://reddit.com/r/Economics/comments/141bp3w/eggs_are_going_on_sale_just_months_after_prices/,Eggs Are Going on Sale Just Months After Prices Hit Records — Supply bounces back from avian influenza hardship,suburban_robot,News,1685965092.0
Economics,https://reddit.com/r/Economics/comments/1412gsq/saudi_arabia_to_cut_oil_output_by_1_million/,Saudi Arabia to cut oil output by 1 million barrels per day to boost slumping prices -,Legitimate_Growth356,,1685940238.0
