subreddit,url,title,author,linkFlairText,date
wallstreetbets,https://reddit.com/r/wallstreetbets/comments/14qbv81/the_only_reason_i_will_never_touch_tsmc/,The only reason I will never touch TSMC,No-Math-5079,Meme,1688467670.0
wallstreetbets,https://reddit.com/r/wallstreetbets/comments/14qb0p3/billionaire_investor_barry_sternlicht_believes/,"Billionaire investor Barry Sternlicht believes that a substantial drop in inflation is imminent, as evidenced by the decline in rents",xx420kevinsteen420xx,News,1688465024.0
wallstreetbets,https://reddit.com/r/wallstreetbets/comments/14q6dmw/someone_help/,Someone help.,TrueReplayJay,Meme,1688449933.0
StockMarket,https://reddit.com/r/StockMarket/comments/14q5q1l/the_duality_of_blackrock/,The duality of BlackRock,Firm-Illustrator-416,News,1688447863.0
StockMarket,https://reddit.com/r/StockMarket/comments/14q11br/do_you_guys_think_that_new_price_target_for_apple/,Do you guys think that new price target for apple is justified now?,Baadhshaah,News,1688434020.0
StockMarket,https://reddit.com/r/StockMarket/comments/14pyvcv/the_case_for_a_2023_us_recession_is_crumbling_cnn/,The case for a 2023 US recession is crumbling | CNN Business,johnwayne2413,News,1688427966.0
Economics,https://reddit.com/r/Economics/comments/14q0aws/the_credit_crunch_is_getting_worse_and/,The credit crunch is getting worse and bankruptcies are on the rise,cool_core_down,News,1688431916.0
Economics,https://reddit.com/r/Economics/comments/14pmhb4/enormously_costly_business_loan_fraud_drove/,"‘Enormously costly’ business loan fraud drove inflation in home prices in certain markets, research suggests",bizsvcs,,1688398801.0
Economics,https://reddit.com/r/Economics/comments/14pma8x/for_these_americans_the_recession_is_already_here/,"For these Americans, the recession is already here",cool_core_down,News,1688398324.0
