subreddit,url,title,author,linkFlairText,date
wallstreetbets,https://reddit.com/r/wallstreetbets/comments/1b73k25/massive_tesla_lot_in_my_backyard_puts_calls/,Massive Tesla Lot in my backyard - puts? calls?,Aggravating_Walk_619,Discussion,1709640058.0
wallstreetbets,https://reddit.com/r/wallstreetbets/comments/1b73cor/tesla_finally_going_to_nosedive/,Tesla Finally going to Nosedive?,Proper_Frosting_6693,Discussion,1709639311.0
wallstreetbets,https://reddit.com/r/wallstreetbets/comments/1b72tbp/daily_discussion_thread_for_march_5_2024/,"Daily Discussion Thread for March 5, 2024",wsbapp,,1709637301.0
Baystreetbets,https://reddit.com/r/Baystreetbets/comments/1b6opzm/is_this_silver_stock_a_potential_gold_powerhouse/,Is This Silver Stock A Potential Gold Powerhouse? - Analyst Coverage by Streetwise Report on Dolly Varden Silver's (DV.v DOLLF) 'Bonanza-Style' Silver and Gold Results,massettawm,DD,1709592433.0
Baystreetbets,https://reddit.com/r/Baystreetbets/comments/1b6i1xe/penny_stocks_to_add_to_your_watchlist_in_march/,Penny stocks to add to your watchlist in March 2024,Stocksy1234,DD,1709576434.0
StockMarket,https://reddit.com/r/StockMarket/comments/1b6pqp2/gold_rises_above_2100_to_highest_level_ever_as/,"Gold rises above $2,100 to highest level ever as traders bet on interest rate cuts",nikola28,News,1709594818.0
Economics,https://reddit.com/r/Economics/comments/1b6rc39/china_sets_ambitious_gdp_target_of_around_5_at/,China Sets Ambitious GDP Target of Around 5% at National People's Congress,bloomberg,News,1709598839.0
