subreddit,url,title,author,linkFlairText,date
wallstreetbets,https://reddit.com/r/wallstreetbets/comments/10xs0kq/daily_discussion_thread_for_february_09_2023/,"Daily Discussion Thread for February 09, 2023",OPINION_IS_UNPOPULAR,Daily Discussion,1675940410.0
wallstreetbets,https://reddit.com/r/wallstreetbets/comments/10xpst6/credit_suisse_buying_a_1person_business_for_175m/,Credit Suisse buying a 1-person “business” for $175m,derekyg,News,1675932058.0
wallstreetbets,https://reddit.com/r/wallstreetbets/comments/10xoivq/tsla_extrarare_tripledouble_reverse_knees_and/,TSLA extra-rare triple-double reverse knees and toes pattern detected. TSLA will go up 7%+ in next two days.,grizzly_teddy,Chart,1675927264.0
wallstreetbets,https://reddit.com/r/wallstreetbets/comments/10xmnbk/carl_bearish_asf/,Carl bearish asf 👀,AsshhhHo,Discussion,1675921001.0
Economics,https://reddit.com/r/Economics/comments/10x282q/schumpeter_the_entrepreneurial_state_and_china/,"Schumpeter, the entrepreneurial state and China",Churrasquinho,Research,1675871983.0
Economics,https://reddit.com/r/Economics/comments/10wpr34/in_state_of_the_union_speech_biden_challenges/,"In State of the Union speech, Biden challenges Republicans on debt and economy",EagleEyes_009,News,1675838613.0
Economics,https://reddit.com/r/Economics/comments/10wpjwj/wall_street_rallies_but_trade_choppy_as_investors/,Wall Street rallies but trade choppy as investors digest Powell comments,EagleEyes_009,News,1675837914.0
Economics,https://reddit.com/r/Economics/comments/10wg3fa/the_case_for_a_land_value_tax_is_overwhelming/,The case for a land value tax is overwhelming,throughpasser,Editorial,1675811001.0
Economics,https://reddit.com/r/Economics/comments/10wd21h/dow_finishes_more_than_250_points_higher_nasdaq/,"Dow finishes more than 250 points higher, Nasdaq climbs 1.9% after Fed Chair Powell says inflation is declining",fadufadu,News,1675803761.0
