subreddit,url,title,author,linkFlairText,date
wallstreetbets,https://reddit.com/r/wallstreetbets/comments/10v3ugl/daily_discussion_thread_for_february_06_2023/,"Daily Discussion Thread for February 06, 2023",OPINION_IS_UNPOPULAR,Daily Discussion,1675681214.0
wallstreetbets,https://reddit.com/r/wallstreetbets/comments/10v3gck/uni_teaching_me_how_to_lose_everything_i_hold_dear/,uni teaching me how to lose everything i hold dear,EwanWhitby,Meme,1675679659.0
wallstreetbets,https://reddit.com/r/wallstreetbets/comments/10v1590/live_view_of_aapl_amzn_googl_reporting_earnings/,Live view of $AAPL $AMZN &amp; $GOOGL reporting earnings,double-chief,Meme,1675670326.0
wallstreetbets,https://reddit.com/r/wallstreetbets/comments/10v07kv/dell_to_cut_6650_jobs_battered_by_plunging_pc/,"Dell to cut 6,650 Jobs, battered by plunging PC sales",s1n0d3utscht3k,News,1675666687.0
Baystreetbets,https://reddit.com/r/Baystreetbets/comments/10v5rvj/demand_for_carbon_credits_is_expected_to_increase/,Demand for carbon credits is expected to increase exponentially (CSE: SHFT) (OTC PINK: SHIFF),PhilipCMS,DD,1675687655.0
Baystreetbets,https://reddit.com/r/Baystreetbets/comments/10tljta/danavation_dvncn_dvncf_announces_two_more/,"Danavation (DVN.CN / DVNCF) announces two more contracts representing approximately CAD$120,000 in up-front revenue + adding to the company’s growing annual recurring revenue base.",Ohrfeigenbaumchen,DD,1675530787.0
Economics,https://reddit.com/r/Economics/comments/10v2eum/study_us_leads_world_in_healthcare_spending/,Study: US leads world in health-care spending,No_Cow1,,1675675404.0
Economics,https://reddit.com/r/Economics/comments/10ux7br/opinion_yes_social_security_and_medicare_still/,"Opinion | Yes, Social Security and Medicare still need to be reformed — and soon",eddytony96,Editorial,1675656632.0
Economics,https://reddit.com/r/Economics/comments/10uu1u2/strong_us_labour_market_results_further_evidence/,Strong US labour market results – further evidence that mainstream monetary theory is flawed,Tough_Gadfly,Blog,1675647517.0
Economics,https://reddit.com/r/Economics/comments/10utu8l/how_the_2020s_economy_could_resemble_the_1980s/,How the 2020s Economy Could Resemble the 1980s,Meloxotic,Blog,1675646951.0
