subreddit,url,title,author,linkFlairText,date
wallstreetbets,https://reddit.com/r/wallstreetbets/comments/1ahseuj/i_declare_bankruptcy/,I declare Bankruptcy. …,AlphaCenturi777,Loss,1706952797.0
wallstreetbets,https://reddit.com/r/wallstreetbets/comments/1ahqc27/was_i_the_only_person_shorting_apple/,Was I the only person shorting Apple?,hishazelglance,Gain,1706944298.0
Economics,https://reddit.com/r/Economics/comments/1aho5pq/china_economy_factory_activity_shrinks_in_no_sign/,China economy: Factory activity shrinks in ‘no sign of turning point’,FIREAdvisory,News,1706936399.0
Economics,https://reddit.com/r/Economics/comments/1ahj0dg/biden_takes_aim_at_grocery_chains_over_food/,"Biden Takes Aim at Grocery Chains Over Food Prices - President Biden has begun to accuse stores of overcharging shoppers, as food costs remain a burden for consumers and a political problem for the president.",Birdy_Cephon_Altera,News,1706920361.0
Economics,https://reddit.com/r/Economics/comments/1ahi5f7/chinas_economy_is_headed_for_slower_growth_imf/,"China's economy is headed for slower growth, IMF says",Slight-Term9370,News,1706917978.0
Economics,https://reddit.com/r/Economics/comments/1ahf5fh/a_jobs_mystery_where_are_all_the_new_employees/,A Jobs Mystery: Where Are All the New Employees Coming From?,wsj,News,1706910245.0
Economics,https://reddit.com/r/Economics/comments/1ah6nlp/the_us_didnt_just_avoid_a_recession_its_adding/,The US didn't just avoid a recession — it's adding hundreds of thousands of new jobs,Barch3,News,1706888633.0
Superstonk,https://reddit.com/r/Superstonk/comments/1ahuip4/the_golden_treasure_100_proof_apes_get_paid/,The Golden Treasure [100% Proof Apes Get Paid],-einfachman-,📚 Due Diligence,1706961387.0
