subreddit,url,title,author,linkFlairText,date
Baystreetbets,https://reddit.com/r/Baystreetbets/comments/1b2lz3x/unveiling_silvers_promise_ceos_insights_on_market/,Unveiling Silver's Promise: CEO's Insights on Market Trends &amp; Homestake Silver Deposit Strategy - Dolly Varden (DV.v),Califanoal,DD,1709165159.0
StockMarket,https://reddit.com/r/StockMarket/comments/1b2t4ku/riot_stock_and_bitcoin/,Riot stock and bitcoin,WorriedMembership486,Discussion,1709186270.0
StockMarket,https://reddit.com/r/StockMarket/comments/1b27hvd/qqq_whos_still_all_in/,QQQ - Who's Still All In?,ResistFlat9916,Fundamentals/DD,1709130942.0
Economics,https://reddit.com/r/Economics/comments/1b2rkhb/wendys_denies_plans_for_surge_pricing_after/,Wendy's denies plans for surge pricing after backlash,galaxystars1,News,1709181148.0
Economics,https://reddit.com/r/Economics/comments/1b2kwwe/gen_z_outpaces_previous_generations_in_retirement/,Gen Z outpaces previous generations in retirement savings,laxnut90,News,1709162483.0
