subreddit,url,title,author,linkFlairText,date
wallstreetbets,https://reddit.com/r/wallstreetbets/comments/1ajbjk6/bby_is_best_buy_gonna_die/,$BBY - Is Best Buy Gonna Die?,SawyerOlson,DD,1707120698.0
wallstreetbets,https://reddit.com/r/wallstreetbets/comments/1aja643/trip_down_memory_lane/,Trip down Memory lane.,Totally_Not_A_POS,Meme,1707115161.0
wallstreetbets,https://reddit.com/r/wallstreetbets/comments/1aj7y0g/bearish_signal_google_trends_searches_for_laid/,"BEARISH SIGNAL - Google trends searches for ""Laid off"" are reaching levels we have only seen since March 2020 and the 2008 recession.",PreviousComment1,Chart,1707107381.0
wallstreetbets,https://reddit.com/r/wallstreetbets/comments/1aj7qkn/looking_for_the_recession_everyone_said_was_coming/,Looking for the recession everyone said was coming,WhiteWhenWrong,Meme,1707106698.0
wallstreetbets,https://reddit.com/r/wallstreetbets/comments/1aj7mof/nvidia_is_evil/,Nvidia is evil,Federal-Rock9086,Meme,1707106348.0
StockMarket,https://reddit.com/r/StockMarket/comments/1aiokic/the_salary_needed_to_purchase_a_medianpriced_home/,The salary needed to purchase a median-priced home has risen 28% YoY. How will young Americans own homes?,Goldenbird666,Discussion,1707055374.0
StockMarket,https://reddit.com/r/StockMarket/comments/1ailrdu/google_parent_alphabet_took_a_12_billion_hit_to/,"Google parent Alphabet took a $1.2 billion hit to exit office space last quarter — news that flew under the radar in a hectic week, says Barclays",goran7,News,1707045604.0
Economics,https://reddit.com/r/Economics/comments/1aj6o3r/why_us_renters_are_taking_corporate_landlords_to/,Why U.S. renters are taking corporate landlords to court,drawkbox,News,1707103261.0
Economics,https://reddit.com/r/Economics/comments/1aj5dmp/powell_federal_reserve_on_track_to_cut_rates_this/,Powell: Federal Reserve on track to cut rates this year with inflation slowing and economy healthy,Barch3,News,1707099206.0
Economics,https://reddit.com/r/Economics/comments/1aj331e/headline_data_look_strong_but_contradictions/,"Headline Data Look ‘Strong,’ But Contradictions Abound",MrCrickets,Research,1707092551.0
